{
  "artifacts": {
    "standard-amd64": {
      "buildkit_provenance": "standard.provenance.json",
      "digest": "sha256:7b16158c7da16207d23cedd2f5b3758390a9908495efe9ffa970c5e5e0a3a9a0",
      "ghcr": {
        "canonical": "ghcr.io/jvallery/frigate@sha256:7b16158c7da16207d23cedd2f5b3758390a9908495efe9ffa970c5e5e0a3a9a0",
        "tag": "ghcr.io/jvallery/frigate:v0.18.0-vallery.20260823.5-standard",
        "verified_digest": "sha256:7b16158c7da16207d23cedd2f5b3758390a9908495efe9ffa970c5e5e0a3a9a0"
      },
      "sbom": "standard.sbom.spdx.json",
      "zot": {
        "canonical": "registry.vallery.net/jvallery/frigate@sha256:7b16158c7da16207d23cedd2f5b3758390a9908495efe9ffa970c5e5e0a3a9a0",
        "tag": "registry.vallery.net/jvallery/frigate:v0.18.0-vallery.20260823.5-standard",
        "verified_digest": "sha256:7b16158c7da16207d23cedd2f5b3758390a9908495efe9ffa970c5e5e0a3a9a0"
      }
    },
    "tensorrt-amd64": {
      "buildkit_provenance": "tensorrt.provenance.json",
      "digest": "sha256:1f6ded33df94bda91efa72b20897ae4ac3160787ff28bb2bf274d6d15a212776",
      "ghcr": {
        "canonical": "ghcr.io/jvallery/frigate@sha256:1f6ded33df94bda91efa72b20897ae4ac3160787ff28bb2bf274d6d15a212776",
        "tag": "ghcr.io/jvallery/frigate:v0.18.0-vallery.20260823.5-tensorrt",
        "verified_digest": "sha256:1f6ded33df94bda91efa72b20897ae4ac3160787ff28bb2bf274d6d15a212776"
      },
      "sbom": "tensorrt.sbom.spdx.json",
      "zot": {
        "canonical": "registry.vallery.net/jvallery/frigate@sha256:1f6ded33df94bda91efa72b20897ae4ac3160787ff28bb2bf274d6d15a212776",
        "tag": "registry.vallery.net/jvallery/frigate:v0.18.0-vallery.20260823.5-tensorrt",
        "verified_digest": "sha256:1f6ded33df94bda91efa72b20897ae4ac3160787ff28bb2bf274d6d15a212776"
      }
    }
  },
  "build": {
    "buildkit": "v0.31.2-rootless",
    "buildx": "v0.36.1",
    "cache_namespace": "jvallery/frigate/arc/cache",
    "docker_cli": "29.7.2",
    "platform": "linux/amd64",
    "runner_profile": "build-trusted",
    "source_date_epoch": 1787508391,
    "workflow_run": "https://github.com/jvallery/frigate/actions/runs/32656991354"
  },
  "created_at": "2026-08-23T19:46:34Z",
  "migrations": [
    {
      "migration_class": "additive_schema_indexes",
      "name": "036_add_query_indexes",
      "path": "migrations/036_add_query_indexes.py",
      "rollback_class": "image_rollback_safe_indexes_remain"
    },
    {
      "migration_class": "history_compatibility_noop",
      "name": "900_performance_indexes",
      "path": "migrations/900_performance_indexes.py",
      "rollback_class": "required_for_existing_history_image_rollback_safe"
    }
  ],
  "patch_ledger": {
    "path": ".vallery/downstream-patches.json",
    "sha256": "sha256:3d77d1c4c277bed3565abada5f6a5893eb27dfe8779e61c268ecdcbaa650169c"
  },
  "promotion": {
    "cluster_mutated_by_build": false,
    "release_class": "additive-schema",
    "required_soaks": [
      "immediate",
      "15m",
      "24h"
    ],
    "rollback_class": "image-rollback-safe-indexes-remain"
  },
  "release_id": "v0.18.0-vallery.20260823.5",
  "schema": "vallery.frigate.release/1",
  "source": {
    "fork_branch": "vallery/prod",
    "fork_repository": "jvallery/frigate",
    "fork_sha": "9dece1f651c76b2a69fdb55748b794534b638d9c",
    "upstream_branch": "dev",
    "upstream_repository": "blakeblackshear/frigate",
    "upstream_sha": "ad79e666eb666d0c858cb95071f6af75f3f29866"
  }
}
